{
  "schema_version": "0.1.0",
  "kind": "ship_registry",
  "retrieved": "2026-06-13",
  "ships": [
    {
      "id": "gns-raoul-courvosier-ii-bc-44",
      "name": "GNS Raoul Courvosier II",
      "prefix": "GNS",
      "hull_number": "BC-44",
      "class_id": "raoul-courvosier-ii",
      "hull_code": 1,
      "navy": "Grayson Space Navy",
      "affiliation_nation_id": "protectorate-of-grayson",
      "role": "lead ship",
      "status": "active",
      "fate_pd": null,
      "canon": true,
      "source": "HH11, Companion",
      "lore": "Lead ship of the first pod-laying battlecruiser class built by any navy."
    },
    {
      "id": "gns-honor-harrington",
      "name": "GNS Honor Harrington",
      "prefix": "GNS",
      "hull_number": null,
      "class_id": "honor-harrington",
      "hull_code": 1,
      "navy": "Grayson Space Navy",
      "affiliation_nation_id": "protectorate-of-grayson",
      "role": "lead ship",
      "status": "active",
      "fate_pd": null,
      "canon": true,
      "source": "HH9",
      "lore": "Name ship of the class, commissioned personally by Allison Chou Harrington, Honor's mother. (Wiki uses the 'GNS' prefix for this ship and 'GSNS' for others in the class \u2014 preserved as written; the inconsistency is unresolved in canon.)"
    },
    {
      "id": "gsns-andrew-massengil",
      "name": "GSNS Andrew Massengil",
      "prefix": "GSNS",
      "hull_number": null,
      "class_id": "honor-harrington",
      "hull_code": 2,
      "navy": "Grayson Space Navy",
      "affiliation_nation_id": "protectorate-of-grayson",
      "role": null,
      "status": "active",
      "fate_pd": null,
      "canon": true,
      "source": "HH9"
    },
    {
      "id": "gsns-isaiah-mackenzie",
      "name": "GSNS Isaiah MacKenzie",
      "prefix": "GSNS",
      "hull_number": null,
      "class_id": "honor-harrington",
      "hull_code": 3,
      "navy": "Grayson Space Navy",
      "affiliation_nation_id": "protectorate-of-grayson",
      "role": null,
      "status": "active",
      "fate_pd": null,
      "canon": true,
      "source": "HH9"
    },
    {
      "id": "hms-star-knight",
      "name": "HMS Star Knight",
      "prefix": "HMS",
      "hull_number": null,
      "class_id": "star-knight",
      "hull_code": 2,
      "navy": "Royal Manticoran Navy",
      "affiliation_nation_id": "star-kingdom-of-manticore",
      "role": "type ship",
      "status": "active",
      "fate_pd": null,
      "canon": true,
      "source": "Companion"
    },
    {
      "id": "hms-fearless-ca-286",
      "name": "HMS Fearless",
      "prefix": "HMS",
      "hull_number": "CA-286",
      "class_id": "star-knight",
      "hull_code": 1,
      "navy": "Royal Manticoran Navy",
      "affiliation_nation_id": "star-kingdom-of-manticore",
      "role": null,
      "status": "active",
      "fate_pd": null,
      "canon": true,
      "source": "HH2",
      "lore": "Honor Harrington's command in the Yeltsin's Star / Grayson campaign (The Honor of the Queen). Not to be confused with the earlier Courageous-class light cruiser HMS Fearless (CL-56) she commanded at Basilisk.",
      "notes": "Ties into systems/yeltsins-star-system.json (the Second Battle of Yeltsin's Star)."
    },
    {
      "id": "hms-warlock-ca-277",
      "name": "HMS Warlock",
      "prefix": "HMS",
      "hull_number": "CA-277",
      "class_id": "star-knight",
      "hull_code": 3,
      "navy": "Royal Manticoran Navy",
      "affiliation_nation_id": "star-kingdom-of-manticore",
      "role": null,
      "status": "constructive total loss",
      "fate_pd": 1921,
      "canon": true,
      "source": "Companion"
    },
    {
      "id": "hms-reliant",
      "name": "HMS Reliant",
      "prefix": "HMS",
      "hull_number": null,
      "class_id": "reliant",
      "hull_code": 3,
      "navy": "Royal Manticoran Navy",
      "affiliation_nation_id": "star-kingdom-of-manticore",
      "role": "lead ship",
      "status": "active",
      "fate_pd": null,
      "canon": true,
      "source": "Companion"
    },
    {
      "id": "hms-nike-bc-413",
      "name": "HMS Nike",
      "prefix": "HMS",
      "hull_number": "BC-413",
      "class_id": "reliant",
      "hull_code": 2,
      "navy": "Royal Manticoran Navy",
      "affiliation_nation_id": "star-kingdom-of-manticore",
      "role": "flagship",
      "status": "active",
      "fate_pd": null,
      "renamed_to": "HMS Hancock Station",
      "canon": true,
      "source": "Companion",
      "lore": "Later recommissioned as HMS Hancock Station \u2014 a name that ties to the Hancock System naval base referenced in nations/star-kingdom-of-manticore.json."
    },
    {
      "id": "hms-achilles-reliant",
      "name": "HMS Achilles",
      "prefix": "HMS",
      "hull_number": null,
      "class_id": "reliant",
      "hull_code": 1,
      "navy": "Royal Manticoran Navy",
      "affiliation_nation_id": "star-kingdom-of-manticore",
      "role": null,
      "status": "active",
      "fate_pd": null,
      "canon": true,
      "source": "Companion"
    },
    {
      "id": "hms-nike-bc-562",
      "name": "HMS Nike",
      "prefix": "HMS",
      "hull_number": "BC-562",
      "class_id": "nike",
      "hull_code": 3,
      "navy": "Royal Manticoran Navy",
      "affiliation_nation_id": "star-kingdom-of-manticore",
      "role": "lead ship / prototype",
      "status": "active",
      "fate_pd": null,
      "canon": true,
      "source": "HH11",
      "lore": "Lead ship, built as a one-off testbed under the Janacek Admiralty; for nearly a year the only Nike in service, whose performance convinced the White Haven Admiralty to mass-produce the class."
    },
    {
      "id": "hms-artemis-nike",
      "name": "HMS Artemis",
      "prefix": "HMS",
      "hull_number": null,
      "class_id": "nike",
      "hull_code": 1,
      "navy": "Royal Manticoran Navy",
      "affiliation_nation_id": "star-kingdom-of-manticore",
      "role": null,
      "status": "active",
      "fate_pd": null,
      "canon": true,
      "source": "Companion"
    },
    {
      "id": "hms-daedalus-nike",
      "name": "HMS Daedalus",
      "prefix": "HMS",
      "hull_number": null,
      "class_id": "nike",
      "hull_code": 2,
      "navy": "Royal Manticoran Navy",
      "affiliation_nation_id": "star-kingdom-of-manticore",
      "role": null,
      "status": "active",
      "fate_pd": null,
      "canon": true,
      "source": "Companion"
    },
    {
      "id": "hms-edward-saganami",
      "name": "HMS Edward Saganami",
      "prefix": "HMS",
      "hull_number": null,
      "class_id": "edward-saganami",
      "hull_code": 2,
      "navy": "Royal Manticoran Navy",
      "affiliation_nation_id": "star-kingdom-of-manticore",
      "role": "type ship",
      "status": "active",
      "fate_pd": null,
      "canon": true,
      "source": "Companion"
    },
    {
      "id": "hms-borelli",
      "name": "HMS Borelli",
      "prefix": "HMS",
      "hull_number": null,
      "class_id": "edward-saganami",
      "hull_code": 1,
      "navy": "Royal Manticoran Navy",
      "affiliation_nation_id": "star-kingdom-of-manticore",
      "role": null,
      "status": "active",
      "fate_pd": null,
      "canon": true,
      "source": "Companion"
    },
    {
      "id": "hms-jessica-epps",
      "name": "HMS Jessica Epps",
      "prefix": "HMS",
      "hull_number": null,
      "class_id": "edward-saganami",
      "hull_code": 3,
      "navy": "Royal Manticoran Navy",
      "affiliation_nation_id": "star-kingdom-of-manticore",
      "role": null,
      "status": "active",
      "fate_pd": null,
      "canon": true,
      "source": "Companion"
    },
    {
      "id": "hms-invictus",
      "name": "HMS Invictus",
      "prefix": "HMS",
      "hull_number": null,
      "class_id": "invictus",
      "hull_code": 3,
      "navy": "Royal Manticoran Navy",
      "affiliation_nation_id": "star-kingdom-of-manticore",
      "role": "lead ship",
      "status": "active",
      "fate_pd": null,
      "canon": true,
      "source": "HH11",
      "lore": "Lead ship; the only Invictus-class unit not built Keyhole II capable."
    },
    {
      "id": "hms-imperator-sd-452",
      "name": "HMS Imperator",
      "prefix": "HMS",
      "hull_number": "SD-452",
      "class_id": "invictus",
      "hull_code": 1,
      "navy": "Royal Manticoran Navy",
      "affiliation_nation_id": "star-kingdom-of-manticore",
      "role": null,
      "status": "active",
      "fate_pd": null,
      "canon": true,
      "source": "HH11",
      "lore": "Assigned with Intransigent to Battle Squadron 61, Eighth Fleet's main wall formation early in the Second Haven-Manticore War."
    },
    {
      "id": "hms-intransigent-invictus",
      "name": "HMS Intransigent",
      "prefix": "HMS",
      "hull_number": null,
      "class_id": "invictus",
      "hull_code": 2,
      "navy": "Royal Manticoran Navy",
      "affiliation_nation_id": "star-kingdom-of-manticore",
      "role": null,
      "status": "active",
      "fate_pd": null,
      "canon": true,
      "source": "HH11"
    },
    {
      "id": "pns-sultan",
      "name": "PNS Sultan",
      "prefix": "PNS",
      "hull_number": null,
      "class_id": "sultan",
      "hull_code": 3,
      "navy": "People's Navy",
      "affiliation_nation_id": "republic-of-haven",
      "role": "lead ship",
      "status": "active",
      "fate_pd": null,
      "canon": true,
      "source": "Companion"
    },
    {
      "id": "pns-rash-al-din",
      "name": "PNS Rash al-Din",
      "prefix": "PNS",
      "hull_number": null,
      "class_id": "sultan",
      "hull_code": 1,
      "navy": "People's Navy",
      "affiliation_nation_id": "republic-of-haven",
      "role": "flagship",
      "status": "active",
      "fate_pd": null,
      "canon": true,
      "source": "Companion",
      "lore": "Rear Admiral Tourville's flagship."
    },
    {
      "id": "pns-saladin",
      "name": "PNS Saladin",
      "prefix": "PNS",